{
  "schema_version": 1,
  "plan_id": "routing-plan-only-2026-04-23",
  "summary": "Routing fixture: a session with only a spec.json and no baseline.json. This simulates the state of a session immediately after plan-creation (or after plan-consolidation) but before any work-implementation has run. The review routing heuristic should dispatch this to plan-review, because there is no executed work to review — only a spec.",
  "goal": "Fixture for /fly:review routing heuristic (plan-only case).",
  "origin": {
    "created_by": "plan-creation",
    "findings_path": null
  },
  "context": {
    "key_files": ["src/example.ts"],
    "patterns": [],
    "gotchas": []
  },
  "behavioral_contract": [
    {
      "id": "BC-ROUTING-001",
      "title": "Plan-only session routes to plan-review",
      "description": "A session with spec.json but no baseline.json should route to plan-review, not work-review.",
      "evidence": "routing.test.sh asserts the helper returns 'plan-review' for this fixture.",
      "area": "routing"
    }
  ],
  "phases": [
    {
      "id": "phase-1",
      "goal": "Do something.",
      "depends_on": [],
      "files": ["src/example.ts"],
      "tasks": [
        {
          "id": "t1.1",
          "description": "Placeholder task so the fixture validates.",
          "files": ["src/example.ts"],
          "test_scenarios": ["Example scenario"],
          "fulfills": ["BC-ROUTING-001"]
        }
      ],
      "verification": "bash tests/work/routing.test.sh",
      "manual_verification": "N/A"
    }
  ],
  "success_criteria": ["Fixture validates against task-list.schema.json"]
}
