{
  "schema_version": 1,
  "plan_id": "add-timeout-flag-2026-04-23",
  "summary": "Add a --timeout flag to the existing CLI entry point so long-running commands can be capped. The flag accepts seconds, defaults to 0 (no timeout), and wraps the main command loop in a SIGALRM handler that is cleared on return. Windows users receive a stderr warning when the flag is supplied because SIGALRM is unavailable. Behavior is opt-in and additive — existing invocations are unchanged.",
  "goal": "Give users a way to cap CLI runtime without shell-level workarounds.",
  "origin": {
    "created_by": "plan-consolidation",
    "findings_path": ".flywheel/plugin/sessions/add-timeout-flag-2026-04-23/findings.json"
  },
  "context": {
    "key_files": ["src/cli.ts"],
    "patterns": ["commander flag registration at src/cli.ts:12-40"],
    "gotchas": [
      "SIGALRM is POSIX-only; platform guard needed for Windows.",
      "Long-lived shells inherit stale signal handlers unless cleared in a finally block."
    ]
  },
  "behavioral_contract": [
    {
      "id": "BC-CLI-001",
      "title": "Timeout flag caps runtime",
      "description": "Invoking the CLI with --timeout N terminates the process after N seconds with exit code 124.",
      "evidence": "Integration test wraps a sleep command and asserts exit 124 within N+1 seconds.",
      "area": "cli"
    },
    {
      "id": "BC-CLI-002",
      "title": "Default behavior unchanged",
      "description": "Without --timeout, the CLI runs to completion with no timeout wrapper installed.",
      "evidence": "Regression test runs existing commands with no flag and asserts behavior matches baseline.",
      "area": "cli"
    }
  ],
  "phases": [
    {
      "id": "phase-1",
      "goal": "Register the flag and wire the timeout wrapper.",
      "depends_on": [],
      "files": ["src/cli.ts"],
      "tasks": [
        {
          "id": "t1.1",
          "description": "Add --timeout <seconds> option to commander in src/cli.ts; parse as integer; validate non-negative.",
          "files": ["src/cli.ts"],
          "test_scenarios": [
            "--timeout 10 sets internal timeout to 10",
            "--timeout 0 disables timeout",
            "--timeout -1 exits with usage error"
          ],
          "fulfills": ["BC-CLI-001"]
        },
        {
          "id": "t1.2",
          "description": "Wrap the command dispatch in a SIGALRM handler when timeout > 0; platform-guard for Windows and print a stderr warning when --timeout is supplied on Windows. Clear the alarm and restore the previous SIGALRM handler in a finally block so long-lived shells do not inherit stale handlers.",
          "files": ["src/cli.ts"],
          "test_scenarios": [
            "Sleep command terminates with exit 124 when --timeout 2",
            "Without --timeout, sleep command runs to completion",
            "On Windows with --timeout 5, stderr contains 'unsupported on this platform'",
            "After successful completion, subsequent SIGALRM does not terminate the shell"
          ],
          "fulfills": ["BC-CLI-001", "BC-CLI-002"]
        }
      ],
      "verification": "bun run test tests/cli/timeout.test.ts",
      "manual_verification": "Run the CLI with --timeout 5 on a long command and confirm it terminates. On Windows, confirm the warning message appears."
    }
  ],
  "success_criteria": [
    "CLI accepts --timeout flag without breaking existing invocations",
    "Integration tests pass on macOS and Linux",
    "Windows users see a clear stderr warning when --timeout is supplied"
  ]
}
