{
  "schema_version": 1,
  "plan_id": "routing-with-baseline-2026-04-23",
  "summary": "Routing fixture: a session with both spec.json and baseline.json present. This simulates a session where work-implementation has already written the baseline (work is either in progress or complete). The review routing heuristic should dispatch this to work-review, because executed work needs review against the frozen baseline.",
  "goal": "Fixture for /fly:review routing heuristic (with-baseline case).",
  "origin": {
    "created_by": "plan-creation",
    "findings_path": null
  },
  "context": {
    "key_files": ["src/example.ts"],
    "patterns": [],
    "gotchas": []
  },
  "behavioral_contract": [
    {
      "id": "BC-ROUTING-002",
      "title": "Session with baseline routes to work-review",
      "description": "A session with both spec.json and baseline.json should route to work-review.",
      "evidence": "routing.test.sh asserts the helper returns 'work-review' for this fixture.",
      "area": "routing"
    }
  ],
  "phases": [
    {
      "id": "phase-1",
      "goal": "Do something.",
      "depends_on": [],
      "files": ["src/example.ts"],
      "tasks": [
        {
          "id": "t1.1",
          "description": "Placeholder task so the fixture validates.",
          "files": ["src/example.ts"],
          "test_scenarios": ["Example scenario"],
          "fulfills": ["BC-ROUTING-002"]
        }
      ],
      "verification": "bash tests/work/routing.test.sh",
      "manual_verification": "N/A"
    }
  ],
  "success_criteria": ["Fixture validates against task-list.schema.json"]
}
