{
  "schema_version": 1,
  "plan_id": "refactor-rigor-gradient-pipeline",
  "summary": "This fixture intentionally declares a BC with zero fulfills claims across all tasks. Schema-level validation passes; the orphan is meant to be caught by the procedural coverage gate.",
  "goal": "Demonstrate that schema-level validation does not catch orphan BCs.",
  "origin": {
    "created_by": "plan-creation",
    "findings_path": null
  },
  "context": {
    "key_files": [],
    "patterns": [],
    "gotchas": []
  },
  "behavioral_contract": [
    {
      "id": "BC-ORPHAN-001",
      "title": "Orphaned contract",
      "description": "No task claims this BC.",
      "evidence": "n/a",
      "area": "demo"
    }
  ],
  "phases": [
    {
      "id": "phase-1",
      "goal": "A phase with no fulfills claim for BC-ORPHAN-001.",
      "depends_on": [],
      "files": [],
      "tasks": [
        {
          "id": "t1",
          "description": "A task that does not claim the orphan BC.",
          "files": [],
          "test_scenarios": [],
          "fulfills": []
        }
      ],
      "verification": "none",
      "manual_verification": ""
    }
  ],
  "success_criteria": []
}
